{
  "socials": [
    {
      "id": "telegram",
      "label": "Telegram",
      "url": "https://t.me/lonelysvobodny",
      "enabled": true,
      "icon": "telegram",
      "newTab": true,
      "title": "Telegram (@lonelysvobodny)",
      "ariaLabel": "Связаться в Telegram: @lonelysvobodny"
    },
    {
      "id": "email",
      "label": "Email",
      "url": "mailto:textsmen@gmail.com",
      "enabled": true,
      "icon": "email",
      "newTab": false,
      "title": "Email (textsmen@gmail.com)",
      "ariaLabel": "Написать на почту: textsmen@gmail.com"
    },
    {
      "id": "youtube",
      "label": "YouTube",
      "url": "https://www.youtube.com/@gnkgonkai",
      "enabled": true,
      "icon": "youtube",
      "newTab": true,
      "title": "YouTube канал",
      "ariaLabel": "YouTube канал GONKA.BLOG"
    },
    {
      "id": "instagram",
      "label": "Instagram",
      "url": "https://instagram.com/gonka_lab",
      "enabled": true,
      "icon": "instagram",
      "newTab": true,
      "title": "Instagram (@gonka_lab)",
      "ariaLabel": "Instagram профиль GONKA.BLOG: @gonka_lab"
    }
  ],
  "english": "https://english.gonka.blog",
  "twohearts": "https://twohearts.gonka.blog",
  "siteviza": "https://siteviza.gonka.blog",
  "atelier": "https://atelier.gonka.blog",
  "landasset5": "https://landasset5.gonka.blog",
  "tracker01": "https://tracker-01.gonka.blog/",
  "reloca": "https://reloca.gonka.blog/"
}
